{
  "$schema": "https://json-schema.org/draft/2020-12/schema",
  "$id": "urn:upos:schema:11:project-adapter:binding:0.1.0",
  "title": "U-POS Project Adapter Binding",
  "description": "Generic non-command binding representation for UPOS-011. COMMAND_BINDING uses its dedicated schema because command_binding_id is a distinct frozen identity.",
  "type": "object",
  "additionalProperties": false,
  "required": [
    "binding_id",
    "binding_type",
    "version",
    "status",
    "abstract_requirement_ref",
    "scope",
    "concrete_target_ref",
    "requiredness",
    "validation_state",
    "compatibility_state",
    "health_state"
  ],
  "properties": {
    "binding_id": {
      "type": "string",
      "minLength": 1
    },
    "binding_type": {
      "enum": [
        "REPOSITORY_BINDING",
        "PATH_BINDING",
        "TOOL_BINDING",
        "PROVIDER_BINDING",
        "IDENTITY_BINDING",
        "RESOURCE_BINDING",
        "CAPABILITY_BINDING",
        "ENVIRONMENT_BINDING",
        "SECRET_BINDING",
        "QUALITY_BINDING",
        "OBSERVABILITY_BINDING",
        "LEARNING_BINDING",
        "APPROVAL_BINDING"
      ]
    },
    "version": {
      "type": "string",
      "minLength": 1
    },
    "status": {
      "enum": [
        "DRAFT",
        "ACTIVE",
        "DEPRECATED",
        "RETIRED",
        "SUPERSEDED"
      ]
    },
    "abstract_requirement_ref": {
      "type": "string",
      "minLength": 1
    },
    "scope": {
      "type": "object",
      "additionalProperties": false,
      "required": [
        "project_id"
      ],
      "properties": {
        "project_id": {
          "type": "string",
          "minLength": 1
        },
        "repository_ref": {
          "type": [
            "string",
            "null"
          ]
        },
        "environment_ref": {
          "type": [
            "string",
            "null"
          ]
        },
        "operation_ref": {
          "type": [
            "string",
            "null"
          ]
        }
      }
    },
    "concrete_target_ref": {
      "type": "string",
      "minLength": 1
    },
    "provider_adapter_ref": {
      "type": [
        "string",
        "null"
      ]
    },
    "provider_adapter_version": {
      "type": [
        "string",
        "null"
      ]
    },
    "configuration_ref": {
      "type": [
        "string",
        "null"
      ]
    },
    "canonical_policy_ref": {
      "type": [
        "string",
        "null"
      ]
    },
    "security_policy_ref": {
      "type": [
        "string",
        "null"
      ]
    },
    "requiredness": {
      "enum": [
        "REQUIRED",
        "OPTIONAL",
        "CONDITIONAL"
      ]
    },
    "effective_from": {
      "type": [
        "string",
        "null"
      ]
    },
    "expires_at": {
      "type": [
        "string",
        "null"
      ]
    },
    "validation_state": {
      "enum": [
        "VALID",
        "VALID_WITH_WARNINGS",
        "INCOMPLETE",
        "INVALID"
      ]
    },
    "compatibility_state": {
      "type": "string",
      "minLength": 1
    },
    "health_state": {
      "type": "string",
      "minLength": 1
    },
    "supersedes": {
      "type": [
        "string",
        "null"
      ]
    },
    "replacement": {
      "type": [
        "string",
        "null"
      ]
    }
  }
}
